{
  "schemaVersion": "character-rig/1.0",
  "status": "core-enforced-fixture-not-production-rig",
  "id": "anthro-standard-v1",
  "species": "anthro",
  "bones": [
    {
      "id": "root",
      "parentId": null,
      "bindTransform": [
        1,
        0,
        0,
        0,
        0,
        1,
        0,
        0,
        0,
        0,
        1,
        0,
        0,
        0,
        0,
        1
      ],
      "constraint": {
        "rotationRadians": {
          "min": [
            0,
            0,
            0
          ],
          "max": [
            0,
            0,
            0
          ]
        },
        "translationLocked": false,
        "scaleLocked": false
      }
    },
    {
      "id": "pelvis",
      "parentId": "root",
      "bindTransform": [
        1,
        0,
        0,
        0,
        0,
        1,
        0,
        0,
        0,
        0,
        1,
        0,
        0,
        0.9,
        0,
        1
      ],
      "constraint": {
        "rotationRadians": {
          "min": [
            -3.141592653589793,
            -3.141592653589793,
            -3.141592653589793
          ],
          "max": [
            3.141592653589793,
            3.141592653589793,
            3.141592653589793
          ]
        },
        "translationLocked": true,
        "scaleLocked": true
      }
    },
    {
      "id": "spine",
      "parentId": "pelvis",
      "bindTransform": [
        1,
        0,
        0,
        0,
        0,
        1,
        0,
        0,
        0,
        0,
        1,
        0,
        0,
        0.24,
        0,
        1
      ],
      "constraint": {
        "rotationRadians": {
          "min": [
            -3.141592653589793,
            -3.141592653589793,
            -3.141592653589793
          ],
          "max": [
            3.141592653589793,
            3.141592653589793,
            3.141592653589793
          ]
        },
        "translationLocked": true,
        "scaleLocked": true
      }
    },
    {
      "id": "chest",
      "parentId": "spine",
      "bindTransform": [
        1,
        0,
        0,
        0,
        0,
        1,
        0,
        0,
        0,
        0,
        1,
        0,
        0,
        0.3,
        0,
        1
      ],
      "constraint": {
        "rotationRadians": {
          "min": [
            -3.141592653589793,
            -3.141592653589793,
            -3.141592653589793
          ],
          "max": [
            3.141592653589793,
            3.141592653589793,
            3.141592653589793
          ]
        },
        "translationLocked": true,
        "scaleLocked": true
      }
    },
    {
      "id": "neck",
      "parentId": "chest",
      "bindTransform": [
        1,
        0,
        0,
        0,
        0,
        1,
        0,
        0,
        0,
        0,
        1,
        0,
        0,
        0.26,
        0,
        1
      ],
      "constraint": {
        "rotationRadians": {
          "min": [
            -3.141592653589793,
            -3.141592653589793,
            -3.141592653589793
          ],
          "max": [
            3.141592653589793,
            3.141592653589793,
            3.141592653589793
          ]
        },
        "translationLocked": true,
        "scaleLocked": true
      }
    },
    {
      "id": "head",
      "parentId": "neck",
      "bindTransform": [
        1,
        0,
        0,
        0,
        0,
        1,
        0,
        0,
        0,
        0,
        1,
        0,
        0,
        0.18,
        0,
        1
      ],
      "constraint": {
        "rotationRadians": {
          "min": [
            -3.141592653589793,
            -3.141592653589793,
            -3.141592653589793
          ],
          "max": [
            3.141592653589793,
            3.141592653589793,
            3.141592653589793
          ]
        },
        "translationLocked": true,
        "scaleLocked": true
      }
    },
    {
      "id": "muzzle",
      "parentId": "head",
      "bindTransform": [
        1,
        0,
        0,
        0,
        0,
        1,
        0,
        0,
        0,
        0,
        1,
        0,
        0,
        -0.02,
        0.16,
        1
      ],
      "constraint": {
        "rotationRadians": {
          "min": [
            -3.141592653589793,
            -3.141592653589793,
            -3.141592653589793
          ],
          "max": [
            3.141592653589793,
            3.141592653589793,
            3.141592653589793
          ]
        },
        "translationLocked": true,
        "scaleLocked": true
      }
    },
    {
      "id": "jaw",
      "parentId": "head",
      "bindTransform": [
        1,
        0,
        0,
        0,
        0,
        1,
        0,
        0,
        0,
        0,
        1,
        0,
        0,
        -0.1,
        0.05,
        1
      ],
      "constraint": {
        "rotationRadians": {
          "min": [
            -0.1,
            -0.1,
            -0.1
          ],
          "max": [
            0.8,
            0.1,
            0.1
          ]
        },
        "translationLocked": true,
        "scaleLocked": true
      }
    },
    {
      "id": "eye.L",
      "parentId": "head",
      "bindTransform": [
        1,
        0,
        0,
        0,
        0,
        1,
        0,
        0,
        0,
        0,
        1,
        0,
        0.08,
        0.05,
        0.1,
        1
      ],
      "constraint": {
        "rotationRadians": {
          "min": [
            -0.5,
            -0.5,
            0
          ],
          "max": [
            0.5,
            0.5,
            0
          ]
        },
        "translationLocked": true,
        "scaleLocked": true
      }
    },
    {
      "id": "eye.R",
      "parentId": "head",
      "bindTransform": [
        1,
        0,
        0,
        0,
        0,
        1,
        0,
        0,
        0,
        0,
        1,
        0,
        -0.08,
        0.05,
        0.1,
        1
      ],
      "constraint": {
        "rotationRadians": {
          "min": [
            -0.5,
            -0.5,
            0
          ],
          "max": [
            0.5,
            0.5,
            0
          ]
        },
        "translationLocked": true,
        "scaleLocked": true
      }
    },
    {
      "id": "ear.L",
      "parentId": "head",
      "bindTransform": [
        1,
        0,
        0,
        0,
        0,
        1,
        0,
        0,
        0,
        0,
        1,
        0,
        0.12,
        0.18,
        0,
        1
      ],
      "constraint": {
        "rotationRadians": {
          "min": [
            -0.7,
            -0.7,
            -0.7
          ],
          "max": [
            0.7,
            0.7,
            0.7
          ]
        },
        "translationLocked": true,
        "scaleLocked": true
      }
    },
    {
      "id": "ear.R",
      "parentId": "head",
      "bindTransform": [
        1,
        0,
        0,
        0,
        0,
        1,
        0,
        0,
        0,
        0,
        1,
        0,
        -0.12,
        0.18,
        0,
        1
      ],
      "constraint": {
        "rotationRadians": {
          "min": [
            -0.7,
            -0.7,
            -0.7
          ],
          "max": [
            0.7,
            0.7,
            0.7
          ]
        },
        "translationLocked": true,
        "scaleLocked": true
      }
    },
    {
      "id": "tail.0",
      "parentId": "pelvis",
      "bindTransform": [
        1,
        0,
        0,
        0,
        0,
        1,
        0,
        0,
        0,
        0,
        1,
        0,
        0,
        0.05,
        -0.18,
        1
      ],
      "constraint": {
        "rotationRadians": {
          "min": [
            -3.141592653589793,
            -3.141592653589793,
            -3.141592653589793
          ],
          "max": [
            3.141592653589793,
            3.141592653589793,
            3.141592653589793
          ]
        },
        "translationLocked": true,
        "scaleLocked": true
      }
    },
    {
      "id": "tail.1",
      "parentId": "tail.0",
      "bindTransform": [
        1,
        0,
        0,
        0,
        0,
        1,
        0,
        0,
        0,
        0,
        1,
        0,
        0,
        0,
        -0.3,
        1
      ],
      "constraint": {
        "rotationRadians": {
          "min": [
            -3.141592653589793,
            -3.141592653589793,
            -3.141592653589793
          ],
          "max": [
            3.141592653589793,
            3.141592653589793,
            3.141592653589793
          ]
        },
        "translationLocked": true,
        "scaleLocked": true
      }
    },
    {
      "id": "tail.2",
      "parentId": "tail.1",
      "bindTransform": [
        1,
        0,
        0,
        0,
        0,
        1,
        0,
        0,
        0,
        0,
        1,
        0,
        0,
        0,
        -0.3,
        1
      ],
      "constraint": {
        "rotationRadians": {
          "min": [
            -3.141592653589793,
            -3.141592653589793,
            -3.141592653589793
          ],
          "max": [
            3.141592653589793,
            3.141592653589793,
            3.141592653589793
          ]
        },
        "translationLocked": true,
        "scaleLocked": true
      }
    },
    {
      "id": "arm.LUpper",
      "parentId": "chest",
      "bindTransform": [
        1,
        0,
        0,
        0,
        0,
        1,
        0,
        0,
        0,
        0,
        1,
        0,
        0.25,
        0.17,
        0,
        1
      ],
      "constraint": {
        "rotationRadians": {
          "min": [
            -2.4,
            -1.5,
            -2.4
          ],
          "max": [
            2.4,
            1.5,
            2.4
          ]
        },